{
  "schema": "oph.instrument-freeze-manifest.v1",
  "campaign_id": "ol_a1_ins02_factorial_2026-09-01",
  "instrument_id": "INS-02",
  "ledger_row": "OL-A1",
  "composition_lane": "FloatingPragma/observer-patch-holography#728 (Spacetime); instrument owned by lane #737",
  "stage": "S1_DESIGN_FROZEN",
  "freeze_utc": "2026-09-01T08:52:16Z",
  "execution_authorized": false,
  "seed_policy": {
    "state": "declared",
    "derivation": "Master seed drawn only at S3 under the fresh-by-grep rule of the preregistration Section 8. Per-run seed for (cell, replicate): first eight bytes, big endian, of sha256 of 'ol_a1_ins02:<master_seed>:<cell_id>:<replicate_id>', as an unsigned integer. Null/control/sham/synthetic streams and execution order derive per Sections 6 and 8. No seed integer exists at this stage."
  },
  "preregistration": {
    "path": "docs/OL_A1_INS02_FACTORIAL_PREREGISTRATION_2026-09-01.md",
    "sha256": "8a352642ccb4c46b35466e221ca11ce47707e2d33caf33d1565f11e3dc48e24c"
  },
  "template": {
    "path": "docs/INSTRUMENT_PREREGISTRATION_TEMPLATE_V1.md",
    "sha256": "b25dad2cd1d201824967378d62cb34dceca675c3e99cb67924f69f8b9475dc10"
  },
  "pinned_code": [
    {
      "path": "oph_fpe/bulk/event_manifold_producer.py",
      "sha256": "02da8d0a419d092a4ece509bf1d8caeeb13f2d337a292847b859001e5782c6fa"
    },
    {
      "path": "oph_fpe/bulk/physical_h3_kms_source_capture.py",
      "sha256": "7e68714ab3e78ffd89b2aec2bb89e9f3c24766c105209bb50497f205eef4b8b5"
    },
    {
      "path": "scripts/einstein_convergence_ladder.py",
      "sha256": "56b99043daddb5f1456d5631b27e728064fb503f2c155968fac0784f6571f7ed"
    },
    {
      "path": "tests/test_event_chart_standardization.py",
      "sha256": "b4799e4fdab030a126e1124e8af64c15f73c03c74002a20eea669abac80bf34b"
    },
    {
      "path": "docs/OL_A1_INSTRUMENT_DEFECT_2026-08-21.md",
      "sha256": "2bd136fa9ffce912021d76e4971436da270d932e41973d63f775ca63aa664262"
    }
  ],
  "decision_rule_verdicts": ["REPLICATED", "FAILED", "INCONCLUSIVE"],
  "equal_prominence": true,
  "claim_boundary_summary": "A REPLICATED verdict supports only: under the repaired standardized estimator, the (1,3,0) robust signature reproduces under fresh seeds across the retained factorial envelope (carrier 16384-65536, absolute support 48-192, observer count 256) and is attributable to ancestry structure against two predeclared null families at rank-test size 4/65 per family, at N = 10 per cell; it moves ledger row OL-A1 only through explicit upstream ledger-control selection. No open-chart topology, no continuum limit, no physical metric, no laboratory prediction, no empirical validation. A FAILED verdict is bounded to this envelope and estimator and is never a universal obstruction. INS-01 (FAILED) remains the controlling completed verdict until superseded by explicit upstream selection.",
  "repository_head": "3bc1dd1b47d8367b661c64f1737a1d348d37e62a",
  "s1_amendment": {
    "amended_utc": "2026-09-23T07:51:44Z",
    "stage": "S1_DESIGN_FROZEN",
    "execution_authorized": false,
    "reason": "upstream files changed 2026-09-01, discovered 2026-09-22, freeze updated to track current upstream state for these two non-decision-rule files only; physical_h3_kms_source_capture.py re-tracked 2026-09-23 after its pair-mean and terminal-lift helpers were factored out (arithmetic unchanged)",
    "pinned_code": [
      {
        "path": "oph_fpe/bulk/event_manifold_producer.py",
        "old_sha256": "02da8d0a419d092a4ece509bf1d8caeeb13f2d337a292847b859001e5782c6fa",
        "new_sha256": "d174eefcabb111a5157ddc45f8523ca197cd684bb3f87512ced29341b7da1652",
        "upstream_commit": "7faa47b5cf00b42f6bf6b3e95ed4f7eb64f4239f"
      },
      {
        "path": "oph_fpe/bulk/physical_h3_kms_source_capture.py",
        "old_sha256": "7e68714ab3e78ffd89b2aec2bb89e9f3c24766c105209bb50497f205eef4b8b5",
        "new_sha256": "516bd2aac726d6de1830a61f76baa98800c50bdadede6c0f4253aeefed72824a",
        "upstream_commit": "c67bacdfb7d042f3048783c7c0a3051b44ff720b"
      }
    ],
    "validator_template": {
      "path": "docs/INSTRUMENT_PREREGISTRATION_TEMPLATE_V1.md",
      "old_sha256": "b25dad2cd1d201824967378d62cb34dceca675c3e99cb67924f69f8b9475dc10",
      "new_sha256": "b0a1b51570ccd0693799304f36221960af45c16afb330efbdb2c06bab5fa3368",
      "reason": "The template contains the digest validator; its S1 amendment support changes template bytes only. The original template pin remains the historical freeze record; this digest pins the amended validation procedure in this commit."
    }
  }
}
